{
  "format": "gdd-extension/0.2",
  "namespace": "example.sensors",
  "version": "0.1.0",
  "node_kinds": {
    "example.sensors.sensor": {
      "description": "A sensor concept as a domain extension.",
      "data_schema": {
        "type": "object",
        "properties": {
          "unit": {
            "type": "string",
            "minLength": 1
          }
        },
        "required": [
          "unit"
        ],
        "additionalProperties": false
      }
    }
  },
  "relations": {
    "example.sensors.measures": {
      "description": "The sensor provides a measurement of the modeled entity.",
      "from": [
        "example.sensors.sensor"
      ],
      "to": [
        "entity"
      ],
      "context": "outgoing",
      "dependency": false,
      "effect": "none",
      "data_schema": {
        "type": "object",
        "additionalProperties": false
      }
    }
  }
}
